{
  "agent_name": "aesthetic_agent",
  "score": 7.5,
  "pass": false,
  "problem_list": [
    "商品主体与价格区视觉权重接近，首屏焦点不够集中"
  ],
  "modify_suggestion": [
    "放大原商品并建立商品→核心卖点→价格的单一路径；保持全部原文与商品素材不变"
  ],
  "protected_content": [
    "商品身份：NORI 600 mL 不锈钢保温杯",
    "商品身份：保温杯",
    "品牌与Logo：NORI",
    "价格与单位：秋日出行价 129 元",
    "促销与期限：秋季限时促销",
    "促销与期限：2026年10月1日至10月15日",
    "卖点：316 不锈钢内胆",
    "卖点：12 小时保温保冷",
    "卖点：一键锁扣 防漏随行",
    "行动提示：立即选购"
  ],
  "meta": {
    "judge_dimensions": [
      "构图与视觉平衡",
      "视觉层级",
      "配色与对比",
      "字体与排版",
      "风格与场景适配",
      "自然质感与完成度"
    ],
    "confidence": 0.82
  }
}
